{
  "blockers": [
    "BLOCKED: no independent qualified legal/tax reviewer has verified the complete law, effective dates, scope, exceptions, and taxpayer-specific applicability. Structural checks are not legal approval.",
    "Provision-level effective dates are not fully verified for the target transaction date.",
    "Candidate-specific exception analysis is incomplete."
  ],
  "candidate_hash": "aa025ecaa1aff2a989f94bbc02710d96c13b40cdca68f55cdbdeee03ce17b4b9",
  "candidate_id": "candidate-eu-article196-eligibility-phase5.6",
  "conditions": [
    "Article 44 place of supply in destination",
    "qualifying recipient status supported",
    "supplier not established in destination under Article 192a",
    "service within reviewed scope"
  ],
  "effective_from": null,
  "effective_to": null,
  "evidence": [
    {
      "authority_level": "primary",
      "content_hash": null,
      "provision": "Article 192a",
      "quote_or_extract": null,
      "retrieved_at": "2026-10-08",
      "source_id": "eu-vat-directive-2025-04-operational",
      "source_url": "https://eur-lex.europa.eu/legal-content/EN/TXT/?uri=CELEX:02006L0112-20250414",
      "source_version": "2025-04-14",
      "supports": "EU Article 196 eligibility screen"
    },
    {
      "authority_level": "primary",
      "content_hash": null,
      "provision": "14 Absatz 4",
      "quote_or_extract": null,
      "retrieved_at": "2026-10-08",
      "source_id": "de-ustg-2026-14-14a",
      "source_url": "https://www.gesetze-im-internet.de/ustg_1980/__14a.html",
      "source_version": "2026-06-29",
      "supports": "EU Article 196 eligibility screen"
    },
    {
      "authority_level": "primary",
      "content_hash": null,
      "provision": "37. § (1)",
      "quote_or_extract": null,
      "retrieved_at": "2026-10-08",
      "source_id": "hu-vat-act-njt-consolidation-2025-12-20",
      "source_url": "https://njt.hu/jogszabaly/2007-127-00-00.100",
      "source_version": "2025-12-20",
      "supports": "EU Article 196 eligibility screen"
    }
  ],
  "exceptions": [
    "All special and mixed service categories excluded pending separately reviewed rules.",
    "Unknown or conflicting facts require human review.",
    "No implementation outside the stated stage."
  ],
  "jurisdiction": "EU",
  "outcome_scope": "EU Article 196 eligibility only; no destination-state implementation",
  "research_hash": "60b8a04622effe249947ac8fb873e9f08817b18dbe847fab55201dd1ec23cc1b",
  "research_id": "research-4f02d5661e1790d85b50",
  "rule_version_id": "eu-article196-eligibility@1",
  "scope": "EU Article 196 eligibility screen",
  "status": "BLOCKED"
}
