{
  "blockers": [
    "BLOCKED: no independent qualified legal/tax reviewer has verified the complete law, effective dates, scope, exceptions, and taxpayer-specific applicability. Structural checks are not legal approval.",
    "Provision-level effective dates are not fully verified for the target transaction date.",
    "Candidate-specific exception analysis is incomplete."
  ],
  "candidate_hash": "17c37a122ef61490af6e6d5a607057ce6ac89ce1496a9497d919c90dd26043ec",
  "candidate_id": "candidate-hu-a60-article262-implementation-phase5.6",
  "conditions": [
    "EU recap obligation established",
    "Hungarian filing/registration status",
    "applicable annual 26A60 version",
    "period assessed separately"
  ],
  "effective_from": null,
  "effective_to": null,
  "evidence": [
    {
      "authority_level": "primary",
      "content_hash": null,
      "provision": "Article 192a",
      "quote_or_extract": null,
      "retrieved_at": "2026-10-08",
      "source_id": "eu-vat-directive-2025-04-operational",
      "source_url": "https://eur-lex.europa.eu/legal-content/EN/TXT/?uri=CELEX:02006L0112-20250414",
      "source_version": "2025-04-14",
      "supports": "Hungarian A60 statutory and form implementation"
    },
    {
      "authority_level": "primary",
      "content_hash": null,
      "provision": "37. § (1)",
      "quote_or_extract": null,
      "retrieved_at": "2026-10-08",
      "source_id": "hu-vat-act-njt-consolidation-2025-12-20",
      "source_url": "https://njt.hu/jogszabaly/2007-127-00-00.100",
      "source_version": "2025-12-20",
      "supports": "Hungarian A60 statutory and form implementation"
    },
    {
      "authority_level": "official_guidance",
      "content_hash": null,
      "provision": "26A60 03-as lap",
      "quote_or_extract": null,
      "retrieved_at": "2026-10-08",
      "source_id": "hu-nav-26a60-2026-filing-guidance",
      "source_url": "https://nav.gov.hu/print/nyomtatvanyok/letoltesek/nyomtatvanykitolto_programok/nyomtatvanykitolto_programok_nav/26A60",
      "source_version": "2026-09-02",
      "supports": "Hungarian A60 statutory and form implementation"
    }
  ],
  "exceptions": [
    "All special and mixed service categories excluded pending separately reviewed rules.",
    "Unknown or conflicting facts require human review.",
    "No implementation outside the stated stage."
  ],
  "jurisdiction": "HU",
  "outcome_scope": "A60 obligation only; reporting period not assessed",
  "research_hash": "60b8a04622effe249947ac8fb873e9f08817b18dbe847fab55201dd1ec23cc1b",
  "research_id": "research-4f02d5661e1790d85b50",
  "rule_version_id": "hu-a60-article262-implementation@1",
  "scope": "Hungarian A60 statutory and form implementation",
  "status": "BLOCKED"
}
